<?xml version="1.0" encoding="UTF-8" standalone="yes"?>
<!--
    Document   : save_example.xml.xml
    Created on : August 31, 2014, 3:31 PM
    Author     : Johan Sarrazin / CÃ©line Fouard / Nicolas Glade
    Description:
        Purpose of the document follows.
-->

<!--Joueur 1-->
<ns1:profil xmlns:ns1="http://myGame/tux" 
        xmlns:xsi="http://www.w3.org/2001/XMLSchema-instance" 
        xsi:schemaLocation="http://myGame/tux ../xsd/profil.xsd">
        
    
        <ns1:nom>Alban</ns1:nom>
        <ns1:avatar>conan.jpg</ns1:avatar>
        <ns1:anniversaire>2006-05-08</ns1:anniversaire>
        <ns1:parties>
            <ns1:partie date="2013-12-10">
                <ns1:temps>20.0</ns1:temps>
                <ns1:niveau difficulte="1">
                    <ns1:mot>Cle</ns1:mot>   
                </ns1:niveau>
            </ns1:partie>
            <ns1:partie trouve="75%" date="2013-12-11">
                <ns1:niveau difficulte="2">
                    <ns1:mot>Indice</ns1:mot>   
                </ns1:niveau>
            </ns1:partie>
            <ns1:partie date="2013-12-11">
                <ns1:temps>20.0</ns1:temps>
                <ns1:niveau difficulte="2">
                    <ns1:mot>Indice</ns1:mot>   
                </ns1:niveau>
            </ns1:partie>
        </ns1:parties>
    
    
</ns1:profil>
